{"schemaVersion":"data.harness/v1","releaseSet":"phase-6","generatedAt":"2026-08-27T12:00:00Z","combinedRuntimeAccepted":false,"components":[{"component":"ADLC","repository":"https://github.com/caglarsubas/agent-hook-v2.git","revision":"aaaaaaaaaaaaaaaaaaaaaaaaaaaaaaaaaaaaaaaa","evidence":{"contract":{"status":"passed","observedAt":"2026-08-27T12:00:00Z","references":["compatibility/phase6"]},"ci":{"status":"missing","observedAt":null,"references":[]},"published":{"status":"missing","observedAt":null,"references":[]},"deployed":{"status":"missing","observedAt":null,"references":[]},"runtimeVerified":{"status":"missing","observedAt":null,"references":[]},"faultVerified":{"status":"missing","observedAt":null,"references":[]},"stakeholderAccepted":{"status":"missing","observedAt":null,"references":[]}}}]}
